{
  "schema": "cockpit.report.v1",
  "tool": {
    "name": "cockpitctl",
    "version": "0.3.0"
  },
  "run": {
    "started_at": "2026-02-02T12:00:00Z"
  },
  "verdict": {
    "status": "fail",
    "counts": {
      "info": 0,
      "warn": 4,
      "error": 2
    },
    "reasons": []
  },
  "sensors": [
    {
      "id": "dupescanner",
      "blocking": true,
      "missing": "fail",
      "presence": "present",
      "report_path": "artifacts/dupescanner/report.json",
      "verdict": {
        "status": "fail",
        "counts": {
          "info": 0,
          "warn": 4,
          "error": 2
        },
        "reasons": [
          "receipt_inconsistent"
        ]
      },
      "truncated": false,
      "errors": [],
      "policy_outcome": "blocked"
    }
  ],
  "highlights": [
    {
      "sensor_id": "dupescanner",
      "finding": {
        "severity": "error",
        "code": "dupescanner.duplicate_code",
        "message": "Duplicate code block detected (same fingerprint)",
        "location": {
          "path": "src/bar.rs",
          "line": 20
        },
        "fingerprint": "deadbeef1234567890abcdef1234567890abcdef1234567890abcdef12345678"
      }
    },
    {
      "sensor_id": "dupescanner",
      "finding": {
        "severity": "warn",
        "code": "dupescanner.similar_code",
        "message": "Similar code pattern found",
        "location": {
          "path": "src/alpha.rs",
          "line": 5
        },
        "fingerprint": "cafebabe1234567890abcdef1234567890abcdef1234567890abcdef12345678"
      }
    },
    {
      "sensor_id": "dupescanner",
      "finding": {
        "severity": "warn",
        "code": "dupescanner.no_fingerprint",
        "message": "This finding has no fingerprint and will get derived one",
        "location": {
          "path": "src/delta.rs",
          "line": 40
        },
        "fingerprint": "20696dd9bc9c85b0c30b7c6a4d44710f218b6577b21327d1b9541e7dedce7600"
      }
    },
    {
      "sensor_id": "dupescanner",
      "finding": {
        "severity": "warn",
        "code": "dupescanner.unique_finding",
        "message": "This finding has a unique fingerprint",
        "location": {
          "path": "src/gamma.rs",
          "line": 30
        },
        "fingerprint": "unique001234567890abcdef1234567890abcdef1234567890abcdef12345678"
      }
    },
    {
      "sensor_id": "dupescanner",
      "finding": {
        "severity": "info",
        "check_id": "cockpit.receipt_inconsistent",
        "code": "cockpit.receipt_inconsistent",
        "message": "Receipt counts for sensor `dupescanner` did not match findings: reported info=0, warn=4, error=1, computed info=0, warn=4, error=2.",
        "help": "Ensure receipt verdict counts match the findings array.",
        "fingerprint": "cockpit.receipt_inconsistent:dupescanner:0:4:1:0:4:2"
      }
    }
  ],
  "policy": {
    "warn_is_fail": false,
    "max_highlights": 7,
    "max_per_sensor_findings": 20,
    "max_annotations": 25,
    "section_order": [
      "Highlights",
      "Repo contract",
      "Policy",
      "Other"
    ],
    "sensors": [
      {
        "id": "dupescanner",
        "blocking": true,
        "missing": "fail",
        "section": "Policy",
        "repro": "dupescanner check"
      }
    ]
  }
}
