{
  "schema": "cockpit.report.v1",
  "tool": { "name": "cockpitctl", "version": "0.1.0" },
  "run": { "started_at": "2026-01-01T00:00:00Z" },
  "verdict": { "status": "fail", "counts": { "info": 0, "warn": 0, "error": 2 }, "reasons": [] },
  "sensors": [
    { "id": "s", "blocking": true, "missing": "fail", "presence": "present", "report_path": "a", "verdict": { "status": "fail", "counts": { "info": 0, "warn": 0, "error": 2 } }, "truncated": false, "errors": [] }
  ],
  "highlights": [
    { "sensor_id": "s", "finding": { "severity": "error", "code": "E1", "message": "no location at all" } },
    { "sensor_id": "s", "finding": { "severity": "error", "code": "E2", "message": "full loc", "location": { "path": "f.rs", "line": 10, "col": 5 } } }
  ],
  "policy": { "warn_is_fail": false, "max_highlights": 7, "max_per_sensor_findings": 20, "max_annotations": 25, "section_order": [], "sensors": [{ "id": "s", "blocking": true, "missing": "fail" }] }
}
