{
  "schema": "cockpit.report.v1",
  "tool": {
    "name": "cockpitctl",
    "version": "0.1.0"
  },
  "run": {
    "started_at": "2026-02-02T12:00:00Z"
  },
  "verdict": {
    "status": "pass",
    "counts": {
      "info": 0,
      "warn": 0,
      "error": 0
    },
    "reasons": []
  },
  "sensors": [
    {
      "id": "hostile",
      "blocking": true,
      "missing": "fail",
      "presence": "present",
      "report_path": "artifacts/hostile/report.json",
      "verdict": {
        "status": "pass",
        "counts": {
          "info": 0,
          "warn": 0,
          "error": 0
        },
        "reasons": []
      },
      "truncated": false,
      "errors": [],
      "policy_outcome": "allowed"
    }
  ],
  "highlights": [],
  "policy": {
    "warn_is_fail": false,
    "max_highlights": 7,
    "max_per_sensor_findings": 20,
    "max_annotations": 25,
    "section_order": [
      "Other"
    ],
    "sensors": [
      {
        "id": "hostile",
        "blocking": true,
        "missing": "fail",
        "section": "Other"
      }
    ]
  }
}
