{
  "schema": "cockpit.report.v1",
  "tool": { "name": "cockpitctl", "version": "0.1.0" },
  "run": { "started_at": "2026-01-01T00:00:00Z" },
  "verdict": {
    "status": "warn",
    "counts": { "info": 1, "warn": 1, "error": 0 },
    "reasons": ["unicode_test"]
  },
  "sensors": [
    {
      "id": "ünïcödé-sensor",
      "blocking": true,
      "missing": "fail",
      "presence": "present",
      "report_path": "artifacts/ünïcödé-sensor/report.json",
      "verdict": { "status": "warn", "counts": { "info": 1, "warn": 1, "error": 0 }, "reasons": [] },
      "truncated": false,
      "errors": []
    }
  ],
  "highlights": [
    {
      "sensor_id": "ünïcödé-sensor",
      "finding": {
        "severity": "warn",
        "code": "ÜNÏCÖDÉ",
        "message": "中文消息 Japanese:日本語 Arabic:العربية Emoji:🎉🚀✨ Backslash:\\ Pipe:| Tab:\t",
        "location": { "path": "src/日本語/テスト.rs", "line": 42 }
      }
    }
  ],
  "policy": {
    "warn_is_fail": false,
    "max_highlights": 7,
    "max_per_sensor_findings": 20,
    "max_annotations": 25,
    "section_order": [],
    "sensors": [{ "id": "ünïcödé-sensor", "blocking": true, "missing": "fail" }]
  }
}
