{
  "schema": "cockpit.report.v1",
  "tool": {
    "name": "cockpitctl",
    "version": "0.2.1"
  },
  "run": {
    "started_at": "2026-02-02T12:00:00Z"
  },
  "verdict": {
    "status": "pass",
    "counts": {
      "info": 0,
      "warn": 0,
      "error": 0
    },
    "reasons": []
  },
  "sensors": [
    {
      "id": "builddiag",
      "blocking": true,
      "missing": "fail",
      "presence": "present",
      "report_path": "artifacts/builddiag/report.json",
      "verdict": {
        "status": "pass",
        "counts": {
          "info": 0,
          "warn": 0,
          "error": 0
        },
        "reasons": []
      },
      "truncated": false,
      "errors": [],
      "policy_outcome": "allowed"
    },
    {
      "id": "perftest",
      "blocking": true,
      "missing": "skip",
      "presence": "missing",
      "report_path": "artifacts/perftest/report.json",
      "verdict": {
        "status": "skip",
        "counts": {
          "info": 0,
          "warn": 0,
          "error": 0
        },
        "reasons": []
      },
      "truncated": false,
      "errors": [],
      "missing_policy_applied": "skip",
      "policy_outcome": "allowed"
    }
  ],
  "highlights": [],
  "policy": {
    "warn_is_fail": false,
    "max_highlights": 7,
    "max_per_sensor_findings": 20,
    "max_annotations": 25,
    "section_order": [
      "Highlights",
      "Repo contract",
      "Policy",
      "Other"
    ],
    "sensors": [
      {
        "id": "builddiag",
        "blocking": true,
        "missing": "fail",
        "section": "Repo contract",
        "repro": "builddiag check --profile team"
      },
      {
        "id": "perftest",
        "blocking": true,
        "missing": "fail",
        "section": "Policy",
        "require_label": "needs-perf-test",
        "repro": "perftest run --baseline main"
      }
    ]
  }
}
