{
  "schema": "cockpit.report.v1",
  "tool": {
    "name": "cockpitctl",
    "version": "0.3.0"
  },
  "run": {
    "started_at": "2026-02-02T12:00:00Z"
  },
  "verdict": {
    "status": "warn",
    "counts": {
      "info": 0,
      "warn": 1,
      "error": 0
    },
    "reasons": []
  },
  "sensors": [
    {
      "id": "builddiag",
      "blocking": true,
      "missing": "fail",
      "presence": "present",
      "report_path": "artifacts/builddiag/report.json",
      "verdict": {
        "status": "pass",
        "counts": {
          "info": 0,
          "warn": 0,
          "error": 0
        },
        "reasons": []
      },
      "truncated": false,
      "errors": [],
      "policy_outcome": "allowed"
    },
    {
      "id": "diffguard",
      "blocking": true,
      "missing": "fail",
      "presence": "present",
      "report_path": "artifacts/diffguard/report.json",
      "verdict": {
        "status": "warn",
        "counts": {
          "info": 0,
          "warn": 1,
          "error": 0
        },
        "reasons": []
      },
      "truncated": false,
      "errors": [],
      "policy_outcome": "allowed"
    }
  ],
  "highlights": [
    {
      "sensor_id": "diffguard",
      "finding": {
        "severity": "warn",
        "code": "diffguard.forbidden_api",
        "message": "Forbidden API introduced: std::mem::transmute",
        "location": {
          "path": "src/lib.rs",
          "line": 42
        },
        "fingerprint": "4c6d0d345d48da2647a0a0c06437030e22e594006b10a281574107a835c58888"
      }
    }
  ],
  "policy": {
    "warn_is_fail": false,
    "max_highlights": 7,
    "max_per_sensor_findings": 20,
    "max_annotations": 25,
    "section_order": [
      "Highlights",
      "Repo contract",
      "Policy",
      "Other"
    ],
    "sensors": [
      {
        "id": "builddiag",
        "blocking": true,
        "missing": "fail",
        "section": "Repo contract",
        "repro": "builddiag check --profile team"
      },
      {
        "id": "diffguard",
        "blocking": true,
        "missing": "fail",
        "section": "Policy",
        "repro": "diffguard check --base $BASE_SHA --head $HEAD_SHA"
      }
    ]
  }
}
