{
  "schema": "cockpit.report.v1",
  "tool": { "name": "cöckpîtctl", "version": "0.1.0" },
  "run": { "started_at": "2026-01-01T00:00:00Z" },
  "verdict": { "status": "warn", "counts": { "info": 0, "warn": 1, "error": 0 }, "reasons": ["🚀"] },
  "sensors": [
    { "id": "ünïcödé", "blocking": true, "missing": "fail", "presence": "present", "report_path": "artifacts/ünïcödé/report.json", "verdict": { "status": "warn", "counts": { "info": 0, "warn": 1, "error": 0 } }, "truncated": false, "errors": [] }
  ],
  "highlights": [
    { "sensor_id": "ünïcödé", "finding": { "severity": "warn", "code": "ÜNÏCÖDÉ", "message": "中文消息 日本語 العربية 🎉", "location": { "path": "src/日本語.rs", "line": 1 } } }
  ],
  "policy": { "warn_is_fail": false, "max_highlights": 7, "max_per_sensor_findings": 20, "max_annotations": 25, "section_order": [], "sensors": [{ "id": "ünïcödé", "blocking": true, "missing": "fail" }] }
}
