{
  "schema": "cockpit.report.v1",
  "tool": { "name": "cockpitctl", "version": "0.1.0" },
  "run": { "started_at": "2026-01-01T00:00:00Z" },
  "verdict": {
    "status": "fail",
    "counts": { "info": 4294967295, "warn": 4294967295, "error": 4294967295 },
    "reasons": []
  },
  "sensors": [
    {
      "id": "extreme",
      "blocking": true,
      "missing": "fail",
      "presence": "present",
      "report_path": "artifacts/extreme/report.json",
      "verdict": { "status": "fail", "counts": { "info": 4294967295, "warn": 4294967295, "error": 4294967295 }, "reasons": [] },
      "truncated": true,
      "errors": []
    }
  ],
  "highlights": [
    { "sensor_id": "extreme", "finding": { "severity": "error", "code": "E1", "message": "a", "location": { "path": "a", "line": 1 } } },
    { "sensor_id": "extreme", "finding": { "severity": "error", "code": "E2", "message": "b", "location": { "path": "b", "line": 2 } } },
    { "sensor_id": "extreme", "finding": { "severity": "error", "code": "E3", "message": "c", "location": { "path": "c", "line": 3 } } },
    { "sensor_id": "extreme", "finding": { "severity": "error", "code": "E4", "message": "d", "location": { "path": "d", "line": 4 } } },
    { "sensor_id": "extreme", "finding": { "severity": "error", "code": "E5", "message": "e", "location": { "path": "e", "line": 5 } } },
    { "sensor_id": "extreme", "finding": { "severity": "warn", "code": "W1", "message": "f", "location": { "path": "f", "line": 6 } } },
    { "sensor_id": "extreme", "finding": { "severity": "warn", "code": "W2", "message": "g", "location": { "path": "g", "line": 7 } } },
    { "sensor_id": "extreme", "finding": { "severity": "info", "code": "I1", "message": "h", "location": { "path": "h", "line": 8 } } }
  ],
  "policy": {
    "warn_is_fail": false,
    "max_highlights": 7,
    "max_per_sensor_findings": 20,
    "max_annotations": 25,
    "section_order": [],
    "sensors": [{ "id": "extreme", "blocking": true, "missing": "fail" }]
  }
}
