{
  "schema": "cockpit.report.v1",
  "tool": {
    "name": "cockpitctl",
    "version": "0.2.0"
  },
  "run": {
    "started_at": "2026-02-02T12:00:00Z"
  },
  "verdict": {
    "status": "warn",
    "counts": {
      "info": 0,
      "warn": 1,
      "error": 0
    },
    "reasons": []
  },
  "sensors": [
    {
      "id": "hintsensor",
      "blocking": true,
      "missing": "fail",
      "presence": "present",
      "report_path": "artifacts/hintsensor/report.json",
      "verdict": {
        "status": "warn",
        "counts": {
          "info": 0,
          "warn": 1,
          "error": 0
        },
        "reasons": [
          "threshold_exceeded"
        ]
      },
      "truncated": false,
      "errors": [],
      "policy_outcome": "allowed"
    }
  ],
  "highlights": [
    {
      "sensor_id": "hintsensor",
      "finding": {
        "severity": "warn",
        "code": "hintsensor.threshold",
        "message": "Metric exceeded threshold: latency p99 = 250ms (limit: 200ms)",
        "fingerprint": "fp_hint_001"
      }
    }
  ],
  "policy": {
    "warn_is_fail": false,
    "max_highlights": 7,
    "max_per_sensor_findings": 20,
    "max_annotations": 25,
    "section_order": [
      "Other"
    ],
    "sensors": [
      {
        "id": "hintsensor",
        "blocking": true,
        "missing": "fail",
        "section": "Other"
      }
    ]
  }
}
