{
  "schema": "cockpit.report.v1",
  "tool": { "name": "cockpitctl", "version": "0.3.0" },
  "run": { "started_at": "2026-01-01T00:00:00Z" },
  "verdict": { "status": "fail", "counts": { "info": 5, "warn": 3, "error": 2 }, "reasons": ["build_failed"] },
  "sensors": [
    {
      "id": "builddiag",
      "blocking": true,
      "missing": "fail",
      "presence": "present",
      "report_path": "artifacts/builddiag/report.json",
      "verdict": { "status": "fail", "counts": { "info": 5, "warn": 3, "error": 2 }, "reasons": [] },
      "truncated": true,
      "errors": [],
      "policy_outcome": "blocked"
    }
  ],
  "highlights": [
    { "sensor_id": "builddiag", "finding": { "severity": "error", "code": "E001", "message": "build failure 1", "location": { "path": "src/main.rs", "line": 1 } } },
    { "sensor_id": "builddiag", "finding": { "severity": "error", "code": "E002", "message": "build failure 2", "location": { "path": "src/lib.rs", "line": 42 } } },
    { "sensor_id": "builddiag", "finding": { "severity": "warn", "code": "W001", "message": "unused var", "location": { "path": "src/util.rs", "line": 10 } } },
    { "sensor_id": "builddiag", "finding": { "severity": "warn", "code": "W002", "message": "dead code", "location": { "path": "src/old.rs", "line": 100 } } },
    { "sensor_id": "builddiag", "finding": { "severity": "warn", "code": "W003", "message": "deprecated API" } },
    { "sensor_id": "builddiag", "finding": { "severity": "info", "code": "I001", "message": "note 1" } },
    { "sensor_id": "builddiag", "finding": { "severity": "info", "code": "I002", "message": "note 2" } },
    { "sensor_id": "builddiag", "finding": { "severity": "info", "code": "I003", "message": "note 3" } },
    { "sensor_id": "builddiag", "finding": { "severity": "info", "code": "I004", "message": "note 4" } },
    { "sensor_id": "builddiag", "finding": { "severity": "info", "code": "I005", "message": "note 5" } }
  ],
  "policy": {
    "warn_is_fail": false,
    "max_highlights": 7,
    "max_per_sensor_findings": 20,
    "max_annotations": 25,
    "section_order": ["Highlights", "Repo contract", "Other"],
    "sensors": [
      { "id": "builddiag", "blocking": true, "missing": "fail", "section": "Repo contract" }
    ]
  }
}
