{
  "schema": "cockpit.report.v1",
  "tool": { "name": "cockpitctl", "version": "0.3.0" },
  "run": { "started_at": "2026-01-01T00:00:00Z" },
  "verdict": { "status": "fail", "counts": { "info": 0, "warn": 0, "error": 1 }, "reasons": [] },
  "sensors": [
    { "id": "builddiag", "blocking": true, "missing": "fail", "presence": "present", "report_path": "a/b/report.json", "verdict": { "status": "fail", "counts": { "info": 0, "warn": 0, "error": 1 }, "reasons": [] }, "truncated": false, "errors": [], "policy_outcome": "blocked" }
  ],
  "highlights": [
    { "sensor_id": "builddiag", "finding": { "severity": "error", "code": "E001", "message": "build failed", "location": { "path": "src/main.rs", "line": 10, "col": 5 } } }
  ],
  "policy": { "warn_is_fail": false, "max_highlights": 7, "max_per_sensor_findings": 20, "max_annotations": 25, "section_order": ["Highlights"], "sensors": [{ "id": "builddiag", "blocking": true, "missing": "fail" }] }
}