{
  "schema": "cockpit.report.v1",
  "tool": {
    "name": "cockpitctl",
    "version": "0.3.0"
  },
  "run": {
    "started_at": "2026-02-02T12:00:00Z"
  },
  "verdict": {
    "status": "pass",
    "counts": {
      "info": 0,
      "warn": 0,
      "error": 0
    },
    "reasons": []
  },
  "sensors": [
    {
      "id": "builddiag",
      "blocking": true,
      "missing": "fail",
      "presence": "present",
      "report_path": "artifacts/builddiag/report.json",
      "verdict": {
        "status": "pass",
        "counts": {
          "info": 0,
          "warn": 0,
          "error": 0
        },
        "reasons": []
      },
      "truncated": false,
      "errors": [],
      "policy_outcome": "allowed"
    },
    {
      "id": "coverage",
      "blocking": false,
      "missing": "skip",
      "presence": "present",
      "report_path": "artifacts/coverage/report.json",
      "verdict": {
        "status": "skip",
        "counts": {
          "info": 0,
          "warn": 0,
          "error": 0
        },
        "reasons": [
          "no_baseline"
        ]
      },
      "truncated": false,
      "errors": [],
      "policy_outcome": "informational"
    }
  ],
  "highlights": [],
  "policy": {
    "warn_is_fail": false,
    "max_highlights": 7,
    "max_per_sensor_findings": 20,
    "max_annotations": 25,
    "section_order": [
      "Highlights",
      "Repo contract",
      "Policy",
      "Other"
    ],
    "sensors": [
      {
        "id": "builddiag",
        "blocking": true,
        "missing": "fail",
        "section": "Repo contract",
        "repro": "builddiag check --profile team"
      },
      {
        "id": "coverage",
        "blocking": false,
        "missing": "skip",
        "section": "Policy",
        "repro": "coverage run --lcov"
      }
    ]
  }
}
