{
  "schema": "cockpit.report.v1",
  "tool": { "name": "cockpitctl", "version": "0.3.0" },
  "run": { "started_at": "2026-01-01T00:00:00Z" },
  "verdict": { "status": "fail", "counts": { "info": 5, "warn": 5, "error": 20 }, "reasons": [] },
  "sensors": [
    { "id": "a", "blocking": true, "missing": "fail", "presence": "present", "report_path": "a", "verdict": { "status": "fail", "counts": { "info": 2, "warn": 2, "error": 10 }, "reasons": [] }, "truncated": true, "errors": [], "policy_outcome": "blocked" },
    { "id": "b", "blocking": false, "missing": "skip", "presence": "present", "report_path": "b", "verdict": { "status": "fail", "counts": { "info": 3, "warn": 3, "error": 10 }, "reasons": [] }, "truncated": true, "errors": [], "policy_outcome": "informational" }
  ],
  "highlights": [
    { "sensor_id": "a", "finding": { "severity": "error", "code": "E1", "message": "err1", "location": { "path": "f1.rs", "line": 1 } } },
    { "sensor_id": "a", "finding": { "severity": "error", "code": "E2", "message": "err2", "location": { "path": "f1.rs", "line": 2 } } },
    { "sensor_id": "a", "finding": { "severity": "error", "code": "E3", "message": "err3", "location": { "path": "f2.rs", "line": 1 } } },
    { "sensor_id": "b", "finding": { "severity": "error", "code": "E4", "message": "err4", "location": { "path": "f3.rs", "line": 10 } } },
    { "sensor_id": "b", "finding": { "severity": "warn", "code": "W1", "message": "warn1" } },
    { "sensor_id": "a", "finding": { "severity": "warn", "code": "W2", "message": "warn2", "location": { "path": "f1.rs", "line": 50 } } },
    { "sensor_id": "a", "finding": { "severity": "info", "code": "I1", "message": "info1" } }
  ],
  "policy": { "warn_is_fail": true, "max_highlights": 3, "max_per_sensor_findings": 5, "max_annotations": 2, "section_order": [], "sensors": [] }
}