{
  "schema": "cockpit.report.v1",
  "tool": { "name": "cockpitctl", "version": "0.1.0" },
  "run": { "started_at": "2026-01-01T00:00:00Z" },
  "verdict": { "status": "fail", "counts": { "info": 0, "warn": 0, "error": 3 }, "reasons": [] },
  "sensors": [
    { "id": "s1", "blocking": true, "missing": "fail", "presence": "present", "report_path": "a", "verdict": { "status": "fail", "counts": { "info": 0, "warn": 0, "error": 1 } }, "truncated": false, "errors": [] },
    { "id": "s2", "blocking": false, "missing": "skip", "presence": "present", "report_path": "b", "verdict": { "status": "fail", "counts": { "info": 0, "warn": 0, "error": 1 } }, "truncated": false, "errors": [] },
    { "id": "s3", "blocking": true, "missing": "warn", "presence": "present", "report_path": "c", "verdict": { "status": "fail", "counts": { "info": 0, "warn": 0, "error": 1 } }, "truncated": false, "errors": [] }
  ],
  "highlights": [
    { "sensor_id": "s1", "finding": { "severity": "error", "code": "E1", "message": "err from sensor 1", "location": { "path": "src/a.rs", "line": 1 } } },
    { "sensor_id": "s2", "finding": { "severity": "error", "code": "E2", "message": "err from sensor 2", "location": { "path": "src/b.rs", "line": 2 } } },
    { "sensor_id": "s3", "finding": { "severity": "error", "code": "E3", "message": "err from sensor 3", "location": { "path": "src/c.rs", "line": 3 } } }
  ],
  "policy": { "warn_is_fail": false, "max_highlights": 1, "max_per_sensor_findings": 1, "max_annotations": 1, "section_order": [], "sensors": [
    { "id": "s1", "blocking": true, "missing": "fail" },
    { "id": "s2", "blocking": false, "missing": "skip" },
    { "id": "s3", "blocking": true, "missing": "warn" }
  ] }
}
