{
  "schema": "cockpit.report.v1",
  "tool": { "name": "", "version": "" },
  "run": { "started_at": "" },
  "verdict": { "status": "pass", "counts": { "info": 0, "warn": 0, "error": 0 }, "reasons": [] },
  "sensors": [
    { "id": "", "blocking": false, "missing": "skip", "presence": "present", "report_path": "", "verdict": { "status": "pass", "counts": { "info": 0, "warn": 0, "error": 0 } }, "truncated": false, "errors": [] }
  ],
  "highlights": [
    { "sensor_id": "", "finding": { "severity": "info", "code": "", "message": "" } }
  ],
  "policy": { "warn_is_fail": false, "max_highlights": 0, "max_per_sensor_findings": 0, "max_annotations": 0, "section_order": [], "sensors": [] }
}
